image_id,image_path,initial_general_caption,"cluster_**composition_style_and_arrangement**__combine_these_criteria_to_cluster_images_based_on_the_deliberate_arrangement_of_food_elements,_such_as_minimalist,_elaborate,_symmetrical,_etc._coarse","cluster_**composition_style_and_arrangement**__combine_these_criteria_to_cluster_images_based_on_the_deliberate_arrangement_of_food_elements,_such_as_minimalist,_elaborate,_symmetrical,_etc._middle","cluster_**composition_style_and_arrangement**__combine_these_criteria_to_cluster_images_based_on_the_deliberate_arrangement_of_food_elements,_such_as_minimalist,_elaborate,_symmetrical,_etc._fine","cluster_**cuisine**__cluster_images_based_on_their_culinary_origin_or_style,_including_traditional,_modern,_fusion,_etc._coarse","cluster_**cuisine**__cluster_images_based_on_their_culinary_origin_or_style,_including_traditional,_modern,_fusion,_etc._middle","cluster_**cuisine**__cluster_images_based_on_their_culinary_origin_or_style,_including_traditional,_modern,_fusion,_etc._fine",cluster_**dominant_color_scheme**__simplify_this_criterion_by_focusing_on_the_overall_color_scheme_of_each_image._coarse,cluster_**dominant_color_scheme**__simplify_this_criterion_by_focusing_on_the_overall_color_scheme_of_each_image._middle,cluster_**dominant_color_scheme**__simplify_this_criterion_by_focusing_on_the_overall_color_scheme_of_each_image._fine,"cluster_**food_texture_and_appearance**__combine_this_criterion_to_group_images_based_on_the_texture_(smooth,_crunchy,_soft)_and_appearance_(color_scheme,_style,_composition)_of_the_food_being_presented._coarse","cluster_**food_texture_and_appearance**__combine_this_criterion_to_group_images_based_on_the_texture_(smooth,_crunchy,_soft)_and_appearance_(color_scheme,_style,_composition)_of_the_food_being_presented._middle","cluster_**food_texture_and_appearance**__combine_this_criterion_to_group_images_based_on_the_texture_(smooth,_crunchy,_soft)_and_appearance_(color_scheme,_style,_composition)_of_the_food_being_presented._fine","cluster_**food_type_and_category**__combine_these_criteria_to_cluster_images_based_on_the_type_or_category_of_food_being_presented,_such_as_seafood,_meat_dishes,_desserts._coarse","cluster_**food_type_and_category**__combine_these_criteria_to_cluster_images_based_on_the_type_or_category_of_food_being_presented,_such_as_seafood,_meat_dishes,_desserts._middle","cluster_**food_type_and_category**__combine_these_criteria_to_cluster_images_based_on_the_type_or_category_of_food_being_presented,_such_as_seafood,_meat_dishes,_desserts._fine","cluster_**image_context_and_purpose**__merge_these_criteria_to_group_images_based_on_their_context_or_purpose,_such_as_food_presentation_in_a_restaurant,_home-cooked_meal,_food_styling_for_photography_purposes._coarse","cluster_**image_context_and_purpose**__merge_these_criteria_to_group_images_based_on_their_context_or_purpose,_such_as_food_presentation_in_a_restaurant,_home-cooked_meal,_food_styling_for_photography_purposes._middle","cluster_**image_context_and_purpose**__merge_these_criteria_to_group_images_based_on_their_context_or_purpose,_such_as_food_presentation_in_a_restaurant,_home-cooked_meal,_food_styling_for_photography_purposes._fine","cluster_**lighting_conditions_and_photography_angle**__group_these_related_criteria_together_to_cluster_images_by_the_lighting_conditions_(natural,_artificial,_dimly_lit)_and_camera_angle_used_to_capture_them_(overhead_shots,_close-ups,_landscape-oriented)._coarse","cluster_**lighting_conditions_and_photography_angle**__group_these_related_criteria_together_to_cluster_images_by_the_lighting_conditions_(natural,_artificial,_dimly_lit)_and_camera_angle_used_to_capture_them_(overhead_shots,_close-ups,_landscape-oriented)._middle","cluster_**lighting_conditions_and_photography_angle**__group_these_related_criteria_together_to_cluster_images_by_the_lighting_conditions_(natural,_artificial,_dimly_lit)_and_camera_angle_used_to_capture_them_(overhead_shots,_close-ups,_landscape-oriented)._fine","cluster_**meal_setting_and_occasion**__merge_these_criteria_to_group_images_by_the_context_in_which_the_meal_is_typically_served,_including_time_of_day,_occasion,_or_specific_events_like_weddings_or_holidays._coarse","cluster_**meal_setting_and_occasion**__merge_these_criteria_to_group_images_by_the_context_in_which_the_meal_is_typically_served,_including_time_of_day,_occasion,_or_specific_events_like_weddings_or_holidays._middle","cluster_**meal_setting_and_occasion**__merge_these_criteria_to_group_images_by_the_context_in_which_the_meal_is_typically_served,_including_time_of_day,_occasion,_or_specific_events_like_weddings_or_holidays._fine","cluster_**mood_and_atmosphere**__group_images_by_their_evoked_emotions,_such_as_formal,_casual,_comforting,_energizing,_etc._coarse","cluster_**mood_and_atmosphere**__group_images_by_their_evoked_emotions,_such_as_formal,_casual,_comforting,_energizing,_etc._middle","cluster_**mood_and_atmosphere**__group_images_by_their_evoked_emotions,_such_as_formal,_casual,_comforting,_energizing,_etc._fine"
1984428.jpg,./data/food-101/images/eggs_benedict/1984428.jpg," The image displays a plate of food consisting mainly of potato wedges and eggs Benedict, presented on a white ceramic dish with a scalloped edge. The potatoes appear to be seasoned and are scattered across the plate, while the eggs Benedict sit atop some of the potatoes. There is a creamy sauce covering the egg-topped potato wedges, which adds color contrast to the predominantly white dish.

The background suggests an indoor setting with subdued lighting that highlights the food without casting harsh shadows or glare on the plate or table surface. The photo's composition emphasizes the food, making it the central focus of the image.",Symmetrical,Elaborate Symmetrical Composition Style,Elaborate Symmetrical Composition Style with Minimalism,"Based on the description, I would classify the image as:

""Fusion Cuisine""

This classification is supported by the mention of ""a creative fusion of different culinary styles and origins"" in the description, indicating that the dish combines elements from various cuisines to create a unique flavor profile. Additionally, the presentation and combination of ingredients are described as innovative and attention-grabbing, further suggesting a fusion cuisine classification.",Fusion of Western and Asian,Modern Fusion Cuisine Style,"Based on the detailed description of the image, I would classify it as:

 Earth Tones","Based on the description provided, I would classify the image as:

 ""Earthy Browns""

This category matches the dominant colors mentioned in the description, which are primarily neutral and muted shades such as cream, beige, and light brown. The image's overall color scheme is centered around earthy tones, with a focus on warm and comforting colors that create a cozy atmosphere.",Warm Earthy Brown Green Accents,Crunchy Texture,"Based on the provided image description, I would classify the image as:

""Crunchy and rich color scheme""

The description mentions that the dish consists of sliced potatoes with a crunchy texture and fried eggs with soft-set yolks. Additionally, it highlights the warm colors created by the orange from the potatoes and brown from the skin, which complements the neutral background. The presence of cheese adds another layer of flavor and visual interest with its crumbly texture. This combination of crunchy textures and rich color scheme aligns with the selected category.","Based on the content and details provided in the description, I would classify the image into:

""Vibrant color with mixed textures""

This category fits the description as it mentions a variety of colors (orange from the potatoes and brown from the skin) and different textures (crunchy texture of the potatoes, soft-set yolk of the eggs, smooth silky element of cream or sour cream, and crumbly texture of cheese). The image also presents a visually appealing meal that balances contrasting elements.","Based on the content and details provided in the description, I would classify the image as:

 ""Breakfast/Brunch""","Based on the content and details provided in the description, I would classify the image into:

 ""General Comfort Foods""

This category fits the description as the dish is described as a comforting meal, rich, creamy, and hearty. The combination of elements such as the egg dish with potatoes, garnishes, and creamy dressing also suggests that it is an indulgent but satisfying food option, which aligns with the characteristics of General Comfort Foods.",Meat with Multiple Ingredients,Food Styling for Photography,"Based on the content and details provided in the description, I would classify the image as:

 ""Food Presentation for Photography""","Based on the content and details provided in the description, I would classify the image into:

""Food Presentation in a Restaurant""

This classification aligns with the description's mention of a white plate with a rim, suggesting attention to presentation important for restaurant settings. Additionally, the use of vibrant colors and visual harmony created by the arrangement of ingredients and sauce implies a focus on creating an appealing display that is typical of fine dining establishments.","Based on the image description, I would classify the image as:

Artificial Lighting

The description mentions ""potentially artificial lighting given the softness and even illumination of the photograph"", indicating that the image was captured under artificial lighting conditions.","Based on the description, I would classify the image as:

 ""Artificial Close-up Shot""","Based on the provided description, I would classify the image as:

""Artificial Lighting Close-up Shots""

This classification is based on the following details from the description:

- The image is taken indoors, suggesting artificial lighting.
- The focus is on the food items, which indicates a close-up shot.
- The lighting conditions are described as gentle and evenly distributed across the scene, contributing to an overall warm and inviting atmosphere, typical of artificial lighting.","Based on the content and details provided in the description, I would classify the image as:

 ""Informal""
 ""Breakfast"" 

The description mentions that the meal setting is likely an informal, at-home dining experience rather than a formal or special occasion. Additionally, it specifically states that the breakfast appears to be a common choice for early mornings or weekends, which aligns with the ""Breakfast"" category.","Based on the image description, I would classify the image as:

Weekend brunch or breakfast

This category fits the description of a relaxed morning meal setting, likely an informal and at-home dining experience, which is typical for weekends when breakfast might be a leisurely affair.",Breakfast/Weekend Brunch,Comforting,"""Comforting""",Comforting and satisfying
2842968.jpg,./data/food-101/images/bibimbap/2842968.jpg," The image features a close-up view of a vibrant, colorful dish served in a white bowl placed on what appears to be a dark surface with some textures visible beneath it. The dish consists primarily of ingredients that suggest an Asian culinary style, specifically oriental cuisine.

At the center of the image is an egg yolk, cooked to a rich yellow color and glistening with moisture, suggesting it might be poached or soft-boiled. It's surrounded by various vegetables that add a burst of color to the dish. There are strips of carrots in varying shades of orange, cut into thin slices, likely for added texture and visual appeal. There's also what appears to be bok choy or green onions, their bright green hue contrasting with the other elements of the dish.

Adding a protein component are pieces of meat, possibly chicken or pork, cooked until they have a golden-brown sear and appear tender. They're scattered around the egg yolk and vegetables, creating a balance between protein, vegetable, and the soft center of the dish.

A touch of darker ingredients enhances the visual appeal with their contrasting colors. These elements could be soy sauce or mushrooms, adding depth to the overall presentation. The white bowl holding these ingredients accentuates their vibrancy and freshness.

There's no visible text on the image that provides additional context about the dish or its specific preparation method.","Based on the detailed description of the image, I would classify it as:

Elaborate

This classification is based on the fact that the image depicts a dish with an ""elaborate and balanced composition style and arrangement"" which involves various key elements such as color contrast, symmetry, proportions, layers, textures, and surface reflections. The presence of these deliberate arrangement criteria suggests that the image falls under the category of ""Elaborate"".","Based on the detailed description provided, I would classify the image as:

 ""Elaborate Composition Style and Arrangement""

This classification is based on the description's emphasis on an ""elaborate and balanced composition style and arrangement"" with various elements such as color contrast, symmetry, proportions, layers, textures, and surface reflections all contributing to a visually appealing dish.","Based on the detailed description provided, I would classify the image as:

""Elaborate Composition Style and Arrangement with Careful Attention"" 

This classification is based on the description's emphasis on the deliberate arrangement of food elements, such as color contrast and harmony, symmetry, proportions, layers, textures, and surface reflections. The description highlights an ""elaborate and balanced composition style and arrangement"" with attention to detail in each aspect, making it a clear fit for this category.","Based on the detailed description provided, the image appears to be a harmonious blend of various culinary traditions from Asia, combining elements such as fresh vegetables, an egg, meat (possibly chicken), and soy-based sauce. The description specifically mentions that this dish ""demonstrates a fusion approach to cuisine, blending elements from various culinary traditions into a harmonious and delicious creation."" 

Therefore, the correct classification is:

Fusion Cuisine","""Asian Fusion Cuisine Style"".",Asian-Fusion Cuisine,"Based on the detailed description, I would classify the image as:

 Warm Colors","Based on the detailed description of the image, I would classify it as:

Harmonious Warm

This classification is supported by the description's emphasis on a ""harmonious blend of colors"" and the presence of warm tones such as golden (from the egg yolk), orange (from the carrots), and yellow-green hues (from the zucchini). The mention of ""earthly tone"" from the seaweed also adds depth, but it is still within the warm color spectrum. Overall, the image's dominant color scheme aligns with the characteristics of a harmonious warm color palette.","Based on the content and details provided in the description, I would classify the image into:

 ""Harmonious blend of warm colors""

This category fits well with the description of the dominant color scheme as a ""harmonious blend of colors"" that creates a visually appealing contrast. The presence of warm colors such as the golden tone of the egg, bright orange and green hues of the vegetables, and earthy tones from the black seaweed also supports this classification.","Based on the detailed description provided, I would classify the image as:

""Crunchy Texture""

This classification is based on the presence of ""crunchy vegetables such as carrots and zucchini"" mentioned in the description. The combination of crunchy texture with softer ingredients like noodles, eggs, and possibly tofu or meat also supports this classification.","Based on the description, I would classify the image into:

Mixed textures and appearances

This category matches the description as it mentions a variety of textures (crunchy vegetables, softer ingredients like noodles and eggs) and appearances (vibrant color scheme, well-thought-out presentation with balance and harmony).","Based on the detailed description provided, I would classify the image into the category:

""Vibrant color with mixed textures""

This classification aligns with the description's emphasis on the dish's vibrant and colorful appearance, as well as its combination of various textures (crunchy vegetables, softer ingredients like noodles and eggs) that interact harmoniously to create a visually appealing and satisfying meal.","Based on the detailed description of the image, I would classify it as:

Breakfast/Brunch

This classification is supported by the description's mention of an egg (possibly fried or poached) being a main component, along with various vegetables and a mix of protein sources, which is common for breakfast or brunch meals.",Breakfast and Brunch Meals,"Based on the detailed description of the image, which includes a mix of protein sources (egg), vegetables (zucchini and carrots), and an emphasis on a hearty and nutritious breakfast or brunch meal, I would classify the image as:

Dishes Served with Meat or Seafood

This classification adheres to the details mentioned in the image description, particularly since the main components are an egg (protein source) and various vegetables, indicating that it is a dish served with meat or seafood.",Food Styling for Photography,"Based on the content and details provided in the description, I would classify the image into:

 ""Food Presentation for Photography""","""Stylized Food Photography for Advertising""","Based on the provided image description, I would classify the image as:

Natural Lighting

The description states that the lighting in the image is characterized by brightness that illuminates the food items, suggesting natural light sources. This suggests that the image was captured under natural lighting conditions, rather than artificial or dimly lit conditions.","Based on the description provided, I would classify the image as:

Artificial Overhead Shot

This classification is based on the description of the lighting conditions being well-lit and suggesting natural or artificial light sources, which aligns with the ""Artificial"" category. Additionally, the camera angle being taken from an overhead view matches the ""Overhead Shot"" category.","Based on the detailed description, the image is best classified as:

Artificial Lighting Overhead Shots

This classification aligns with the provided details that mention ""The lighting in this image is characterized by brightness that illuminates the food items, suggesting natural or artificial light sources"" and ""The camera angle appears to be taken from an overhead view"". These points suggest that the lighting conditions are artificial (due to the brightness) and the camera angle is overhead.",Informal,Weekend brunch or breakfast,Casual daytime health-conscious dining,"Based on the content and details provided in the description, I would classify the image as:

 ""Comforting""","Based on the content and details provided in the description, I would classify the image into the category:

 ""Warm and inviting atmosphere""","Based on the content and details provided in the description, I would classify the image as:

 ""Comforting Warmth and Nourishment"""
